{
  "id": "urn:ngsi-ld:TunnelHollowSpace:001",
  "type": "TunnelHollowSpace",
  "dateCreated": "2026-08-28T10:00:00Z",
  "dateModified": "2026-08-28T10:00:00Z",
  "source": "https://github.com/cityjson/specs",
  "dataProvider": "CityJSON community (cityjson.org)",
  "attributes": {
    "function": "maintenance passage"
  },
  "geographicalExtent": [
    4.35,
    52.02,
    0.0,
    4.351,
    52.0208,
    10.0
  ],
  "parents": [
    "urn:ngsi-ld:Tunnel:001"
  ],
  "geometryLoD2": {
    "type": "MultiPolygon",
    "coordinates": [
      [
        [
          [
            4.35,
            52.02,
            0.0
          ],
          [
            4.351,
            52.02,
            0.0
          ],
          [
            4.351,
            52.0208,
            3.0
          ],
          [
            4.35,
            52.0208,
            3.0
          ],
          [
            4.35,
            52.02,
            0.0
          ]
        ]
      ]
    ]
  }
}
